{
    "id": "gd1-c394c4b7b1246c8c3a5531a7661a51cfb787f79de4fda997168fc0acd37564f2",
    "$schema": "https://raw.githubusercontent.com/offline-agency/php-image-puzzle/HEAD/docs/schemas/game/v1/definition.schema.json",
    "format": "image-puzzle/game-definition",
    "version": 1,
    "kind": "swap",
    "generator": {
        "algorithm": 1
    },
    "seed": 2,
    "preset": {
        "name": "medium",
        "version": 1
    },
    "source": {
        "width": 640,
        "height": 480,
        "sha256": "ddeb783c0a5e5bc2927c98903abcebdbaa01ccae446c8337c2278a8f3901b80d"
    },
    "media": {
        "image": "picture.png"
    },
    "board": {
        "rows": 4,
        "cols": 4,
        "crop": {
            "x": 0,
            "y": 0,
            "width": 640,
            "height": 480
        }
    },
    "tiles": [
        {
            "id": "t0",
            "home": 0,
            "rect": {
                "x": 0,
                "y": 0,
                "width": 160,
                "height": 120
            }
        },
        {
            "id": "t1",
            "home": 1,
            "rect": {
                "x": 160,
                "y": 0,
                "width": 160,
                "height": 120
            }
        },
        {
            "id": "t2",
            "home": 2,
            "rect": {
                "x": 320,
                "y": 0,
                "width": 160,
                "height": 120
            }
        },
        {
            "id": "t3",
            "home": 3,
            "rect": {
                "x": 480,
                "y": 0,
                "width": 160,
                "height": 120
            }
        },
        {
            "id": "t4",
            "home": 4,
            "rect": {
                "x": 0,
                "y": 120,
                "width": 160,
                "height": 120
            }
        },
        {
            "id": "t5",
            "home": 5,
            "rect": {
                "x": 160,
                "y": 120,
                "width": 160,
                "height": 120
            }
        },
        {
            "id": "t6",
            "home": 6,
            "rect": {
                "x": 320,
                "y": 120,
                "width": 160,
                "height": 120
            }
        },
        {
            "id": "t7",
            "home": 7,
            "rect": {
                "x": 480,
                "y": 120,
                "width": 160,
                "height": 120
            }
        },
        {
            "id": "t8",
            "home": 8,
            "rect": {
                "x": 0,
                "y": 240,
                "width": 160,
                "height": 120
            }
        },
        {
            "id": "t9",
            "home": 9,
            "rect": {
                "x": 160,
                "y": 240,
                "width": 160,
                "height": 120
            }
        },
        {
            "id": "t10",
            "home": 10,
            "rect": {
                "x": 320,
                "y": 240,
                "width": 160,
                "height": 120
            }
        },
        {
            "id": "t11",
            "home": 11,
            "rect": {
                "x": 480,
                "y": 240,
                "width": 160,
                "height": 120
            }
        },
        {
            "id": "t12",
            "home": 12,
            "rect": {
                "x": 0,
                "y": 360,
                "width": 160,
                "height": 120
            }
        },
        {
            "id": "t13",
            "home": 13,
            "rect": {
                "x": 160,
                "y": 360,
                "width": 160,
                "height": 120
            }
        },
        {
            "id": "t14",
            "home": 14,
            "rect": {
                "x": 320,
                "y": 360,
                "width": 160,
                "height": 120
            }
        },
        {
            "id": "t15",
            "home": 15,
            "rect": {
                "x": 480,
                "y": 360,
                "width": 160,
                "height": 120
            }
        }
    ],
    "rules": {},
    "actions": [
        "swap"
    ],
    "capabilities": {
        "undo": true,
        "redo": true,
        "reset": true,
        "shuffle": true,
        "hint": true
    },
    "assistance": {
        "preview": true,
        "numbers": false,
        "highlightCorrect": true
    },
    "initial": {
        "cells": [
            "t3",
            "t2",
            "t5",
            "t7",
            "t8",
            "t1",
            "t14",
            "t10",
            "t0",
            "t13",
            "t4",
            "t6",
            "t11",
            "t15",
            "t9",
            "t12"
        ]
    }
}
