{
    "id": "gd1-4d1914a19a272815f5af29afc0b873a8ccccb544e59fda6ab59c44666d73991c",
    "$schema": "https://raw.githubusercontent.com/offline-agency/php-image-puzzle/HEAD/docs/schemas/game/v1/definition.schema.json",
    "format": "image-puzzle/game-definition",
    "version": 1,
    "kind": "sliding",
    "generator": {
        "algorithm": 1
    },
    "seed": 1,
    "preset": {
        "name": "easy",
        "version": 1
    },
    "source": {
        "width": 640,
        "height": 480,
        "sha256": "ddeb783c0a5e5bc2927c98903abcebdbaa01ccae446c8337c2278a8f3901b80d"
    },
    "media": {
        "image": "picture.png"
    },
    "board": {
        "rows": 3,
        "cols": 3,
        "crop": {
            "x": 0,
            "y": 0,
            "width": 639,
            "height": 480
        }
    },
    "tiles": [
        {
            "id": "t0",
            "home": 0,
            "rect": {
                "x": 0,
                "y": 0,
                "width": 213,
                "height": 160
            }
        },
        {
            "id": "t1",
            "home": 1,
            "rect": {
                "x": 213,
                "y": 0,
                "width": 213,
                "height": 160
            }
        },
        {
            "id": "t2",
            "home": 2,
            "rect": {
                "x": 426,
                "y": 0,
                "width": 213,
                "height": 160
            }
        },
        {
            "id": "t3",
            "home": 3,
            "rect": {
                "x": 0,
                "y": 160,
                "width": 213,
                "height": 160
            }
        },
        {
            "id": "t4",
            "home": 4,
            "rect": {
                "x": 213,
                "y": 160,
                "width": 213,
                "height": 160
            }
        },
        {
            "id": "t5",
            "home": 5,
            "rect": {
                "x": 426,
                "y": 160,
                "width": 213,
                "height": 160
            }
        },
        {
            "id": "t6",
            "home": 6,
            "rect": {
                "x": 0,
                "y": 320,
                "width": 213,
                "height": 160
            }
        },
        {
            "id": "t7",
            "home": 7,
            "rect": {
                "x": 213,
                "y": 320,
                "width": 213,
                "height": 160
            }
        },
        {
            "id": "t8",
            "home": 8,
            "rect": {
                "x": 426,
                "y": 320,
                "width": 213,
                "height": 160
            }
        }
    ],
    "rules": {
        "empty": "t8",
        "scrambleMoves": 60
    },
    "actions": [
        "slide"
    ],
    "capabilities": {
        "undo": true,
        "redo": true,
        "reset": true,
        "shuffle": true,
        "hint": false
    },
    "assistance": {
        "preview": true,
        "numbers": true,
        "highlightCorrect": true
    },
    "initial": {
        "cells": [
            "t2",
            "t0",
            "t7",
            "t1",
            "t6",
            "t5",
            "t3",
            "t4",
            null
        ]
    }
}
